{
  "spec_version": "0.1",
  "entry_id": "sl_01JB0F6Q2W7Y8K3M5N9P1R4T6V",
  "created_at": "2026-10-21T09:14:03Z",
  "field": {
    "name": "hs_code",
    "description": "The customs tariff (HS) code mentioned for the shipment",
    "pointable": true
  },
  "value": "6110.20",
  "source": {
    "sha256": "1b07a4e6fd2e85945a563ed7988e34ae1ad6762579803551944a188ca13619a3",
    "media_type": "text/plain",
    "uri": "examples/email/source.txt",
    "length": 322
  },
  "transforms": [],
  "selector": {
    "position": {
      "start": 192,
      "end": 199,
      "unit": "codepoint",
      "against": "source"
    },
    "quote": {
      "exact": "6110.20",
      "prefix": "HS code ",
      "suffix": " flagged"
    }
  },
  "extractor": {
    "model": "extract",
    "provider": "scaledown"
  },
  "confidence": 0.91,
  "verification": {
    "status": "exact",
    "unit_detected": "codepoint",
    "checked_at": "2026-10-21T09:14:03Z",
    "checker": "source-bound verifier 0.1"
  },
  "support": {
    "status": "unreviewed"
  }
}
